{
  "overall_assessment": {
    "status": "request_changes",
    "summary": "메모리 안전성 개선이 주요 목적이나, free 후 포인터 처리 및 buffer 소유권 관리가 누락되어 추가 수정이 필요합니다.",
    "risk_level": "medium",
    "approval_suggestion": "ISS-001, ISS-002 수정 후 승인 권장"
  },
  "spec_coverage": {
    "total_specs": 3,
    "matched_specs": 2,
    "partially_matched": 0,
    "unmatched_specs": [
      {
        "spec_id": "CHG-003",
        "description": "에러 처리 경로에서 double-free 버그 수정",
        "possible_reason": "관련 코드가 이 PR에 포함되지 않았거나 다른 방식으로 해결됨"
      }
    ]
  },
  "key_issues": [
    {
      "id": "ISS-002",
      "type": "logic_error",
      "severity": "major",
      "file_name": "drivers/nand/nand_read.c",
      "title": "외부 전달 buffer와 내부 할당 buffer 구분 없이 해제",
      "priority_score": 75
    },
    {
      "id": "ISS-001",
      "type": "memory",
      "severity": "major",
      "file_name": "drivers/nand/nand_read.c",
      "title": "free 후 buffer 포인터 미초기화",
      "priority_score": 72
    }
  ],
  "file_summaries": [
    {
      "file_name": "drivers/nand/nand_read.c",
      "change_summary": "null 체크 추가로 메모리 안전성 개선",
      "issue_count": 2,
      "highest_severity": "major"
    },
    {
      "file_name": "drivers/nand/buffer.c",
      "change_summary": "참조 카운트 추적 기능 추가",
      "issue_count": 0,
      "highest_severity": "none"
    }
  ],
  "statistics": {
    "total_files": 2,
    "files_with_issues": 1,
    "total_issues": 2,
    "issues_by_severity": {
      "critical": 0,
      "major": 2,
      "minor": 0,
      "info": 0
    },
    "issues_by_type": {
      "memory": 1,
      "logic_error": 1
    }
  },
  "recommendations": [
    {
      "priority": 1,
      "action": "nand_read.c의 buffer 소유권 관리 로직 추가",
      "reason": "외부 전달 buffer를 해제하면 호출자 측 메모리 corruption 발생 가능",
      "related_issues": ["ISS-002"]
    },
    {
      "priority": 2,
      "action": "free 후 buffer = NULL 추가",
      "reason": "dangling pointer로 인한 잠재적 use-after-free 위험",
      "related_issues": ["ISS-001"]
    },
    {
      "priority": 3,
      "action": "CHG-003 명세 관련 코드 확인",
      "reason": "double-free 수정이 PR에 반영되지 않은 것으로 보임",
      "related_issues": []
    }
  ]
}
